Subject,Calculator Name,Website URL,Core Formula/Method,Distance Range Covered,Required Inputs,Outputs Provided,Sprint Event Handling,Known Weaknesses & Criticisms,Energy System Awareness,Unique Differentiating Features,Coach Credibility Score,Coach Credibility Reasoning,Error
Strava estimated best efforts and fitness/freshness tools,Strava Performance Predictions and Fitness/Freshness,https://www.strava.com,"Strava utilizes two distinct methodologies for its tools. For the Fitness/Freshness chart, it employs an impulse-response model originally developed by Dr. Eric W. Banister and later adapted by Dr. Andy Coggan. The Fitness score (analogous to Chronic Training Load) is an exponentially weighted moving average of daily Training Load over approximately 42 days, decaying at about 2.5% per day if inactive. Fatigue (Acute Training Load) is a shorter-term moving average over about 7 days. Form is calculated as Fitness minus Fatigue. Training Load is derived from power data, or Relative Effort based on heart rate/perceived exertion. For Performance Predictions, Strava uses a proprietary machine learning model trained on over 100 athlete data attributes, including all-time run history and top performances, comparing the user to athletes with similar training histories rather than relying on theoretical inputs like estimated VO2 max.",400m to 50k,"GPS activity data, Heart rate data, Power meter data, Perceived exertion input","Estimated race completion times (5K, 10K, Half Marathon, Marathon), Fitness score, Fatigue score, Form score, Lifetime best efforts, Annual best efforts","Strava completely ignores sprint events under 400m. Its Best Efforts tracking begins at 400m and extends up to 50k. It does not attempt to predict sprint times (100m, 200m) from distance times, nor does it provide performance predictions for any distance shorter than 5K. The platform is fundamentally designed for endurance athletes rather than sprinters.","Strava's tools have several documented weaknesses. The Performance Predictions model assumes a flat, track-like course and does not account for terrain, altitude, or weather conditions, which can lead to overly optimistic marathon predictions for runners training on hilly terrain. The Fitness/Freshness model heavily relies on accurate FTP (Functional Threshold Power) or maximum heart rate settings; incorrect settings render the scores meaningless. Furthermore, the Best Efforts feature uses elapsed time rather than moving time, meaning any stops during a run will negatively impact the recorded effort. The system also completely ignores sprint distances under 400m, making it useless for short sprinters. Finally, the AI predictions require a minimum of 20 runs in 24 weeks, which can be restrictive for athletes returning from injury or those who cross-train heavily.",None - treats all distances as single continuum,"Unlike traditional calculators that rely on theoretical formulas like VO2 max estimates or the Riegel formula, Strava's Performance Predictions use a machine learning model based on the actual historical data of millions of athletes. It compares your training history to others with similar profiles to generate realistic predictions. Additionally, the integration of the Fitness/Freshness chart directly with social and segment data provides a holistic view of an athlete's progression within a community context, automatically filling in gaps using Relative Effort when power data is unavailable.",6,"A knowledgeable track/XC coach would likely have mixed feelings about Strava's tools. On one hand, the Fitness/Freshness chart is based on the well-established Banister impulse-response model (similar to TrainingPeaks' CTL/ATL/TSB), which coaches respect for tracking training load and periodization. However, the reliance on heart rate or perceived exertion when power data is absent can introduce significant inaccuracies. Regarding Performance Predictions, coaches are often skeptical of machine learning models that do not account for course terrain, weather, or race-day psychology. Furthermore, Strava's lack of support for sprint distances (under 400m) and its focus on elapsed time rather than moving time for Best Efforts can frustrate coaches who need precise track data. Overall, while useful for general fitness tracking, it lacks the precision required for elite coaching.",
RunnerConnect race calculator and McMillan Running Calculator (Greg McMillan),McMillan Running Calculator,https://www.mcmillanrunning.com/,"The McMillan Running Calculator does not use a single, simple mathematical equation like the Riegel formula (T2 = T1 x (D2/D1)^1.06). Instead, it uses a proprietary, complex algorithm developed by Greg McMillan in the mid-1990s. The method is a combination of real-world performance data and physiological data, specifically the correlation between blood lactate levels and running performance. It estimates equivalent race performances and optimal training paces by comparing a runner's current race time against a vast database of performances and physiological benchmarks. While the exact mathematical formula is kept proprietary, it functions as a sophisticated lookup table and interpolation system that adjusts for the non-linear nature of human performance across different distances, rather than relying on a fixed exponent.",100m to 100 Miles,"Recent race distance, Recent race time (hours, minutes, seconds), Goal race time (optional), Runner type (Speedster or Endurance Monster)","Equivalent race times for distances from 100m to 100 miles, Optimal training pace ranges for Endurance workouts (recovery jogs, long runs, easy runs), Stamina workouts, Speed workouts, and Sprint workouts","The McMillan Running Calculator does attempt to handle sprint events, providing equivalent performance estimates for distances as short as 100m, 200m, 400m, and 500m. It also provides specific 'Sprint Workout' pace ranges. However, McMillan notes that these sprint equivalents are 'just educated guesses' because genetic endowment of fast-twitch muscle fibers plays a much greater role in pure sprinting ability than aerobic training. The calculator allows users to select if they are a 'Speedster' or 'Endurance Monster' to slightly adjust the pace ranges for speed and sprint workouts, acknowledging the difficulty of predicting sprint times from distance performances.","The primary documented weakness of the McMillan Running Calculator, which Greg McMillan himself acknowledges, is its handling of individual muscle fiber composition differences. For 'speedsters' (fast-twitch dominant runners), the calculator often over-predicts their performance at longer distances like the marathon, as they struggle to maintain the predicted pace. Conversely, for 'endurance monsters' (slow-twitch dominant runners), it may under-predict their sprint and short-distance times, as their 5K times might look slow compared to their marathon capabilities. Additionally, like most calculators, it assumes 'appropriate training for the distance' and ideal race conditions, failing to account for factors like weekly mileage, wind, temperature, humidity, and course elevation, which can significantly impact actual race times.","The McMillan Running Calculator implicitly accounts for different energy systems by categorizing training paces into four distinct zones: Endurance, Stamina, Speed, and Sprint. These zones correspond to the primary energy systems used during running. Endurance and Stamina workouts primarily target the aerobic system. Speed workouts target the glycolytic (anaerobic) system, improving VO2 max and lactate threshold. Sprint workouts target the ATP-CP (phosphagen) system and neuromuscular recruitment. By providing specific pace ranges for each of these zones, the calculator acknowledges that different physiological adaptations are required for different race distances and that a single continuum model is insufficient for optimal training.","A key unique feature of the McMillan Running Calculator is its classification of runners into 'Speedsters' and 'Endurance Monsters'. This allows the calculator to provide slightly different optimal training pace ranges for Speed and Sprint workouts based on the runner's natural physiological tendencies (fast-twitch vs. slow-twitch dominance). Another unique aspect is its comprehensive output, providing not just race predictions but a full suite of optimal training pace ranges categorized into Endurance, Stamina, Speed, and Sprint zones, effectively serving as a complete training pace guide rather than just a race predictor.",8,"A knowledgeable track/XC coach would likely trust the McMillan Running Calculator as a solid baseline tool, but with caveats. Greg McMillan is a highly respected coach and exercise physiologist, and his calculator is built on a combination of real-world performances and physiological data (including blood lactate levels). It provides a comprehensive set of training paces (Endurance, Stamina, Speed, Sprint) which coaches find very useful for structuring workouts. However, experienced coaches know that no calculator is perfect. They would trust it as a starting point but would adjust based on the individual athlete's profile (fast-twitch vs. slow-twitch dominance), training history, and environmental factors. The calculator's tendency to over-predict marathon times for speed-oriented runners and under-predict sprint times for endurance runners is a known limitation that a good coach would account for.",
Tinman Running Calculator (Tom Schwartz) and his critical velocity approach,Tinman Running Calculator,https://www.finalsurge.com/tinman-calculator,"The exact mathematical formula used by the Tinman Running Calculator is proprietary and not publicly published in full mathematical notation. However, the algorithmic method is based on Tom Schwartz's concept of Critical Velocity (CV), which he defines as the pace a runner can sustain for about 30 to 45 minutes (roughly 90% of VO2 max or slightly faster than lactate threshold). The calculator uses a recent race performance to establish a baseline fitness level, then applies proprietary coefficients to extrapolate equivalent race times across different distances and to calculate specific training paces (Recovery, Easy, Moderate, Tempo, MLSS/Threshold, CV, Aerobic Power, VO2 max, etc.). It essentially maps a single performance onto a physiological curve to predict capabilities across the endurance spectrum.",100m to 100 miles,"Race Distance, Race Time, Gender","Race Splits, Training Paces by Intensity (Recovery, Easy, Moderate, Tempo, MLSS/Threshold, CV, Aerobic Power, VO2 max, Mixed Zone, Anaerobic Capacity, Anaerobic Power, Speed Endurance, Speed), Equivalent Race Times (100m to 100 miles)","The calculator does attempt to handle sprint events (100m, 200m, 400m) by providing both equivalent race times and specific training paces (Speed, Speed Endurance, Anaerobic Power) for these distances. However, it predicts these sprint times based on distance inputs (e.g., predicting a 100m time from a 5K input). This is generally considered a weakness, as sprint performance is heavily dependent on neuromuscular power and anaerobic capacity, which cannot be accurately extrapolated purely from aerobic endurance performances.","A primary documented weakness of the Tinman calculator, common to many running calculators, is its handling of the sprint-to-distance transfer. Because it relies on a single race input to extrapolate across all distances, it assumes a standard physiological profile. It tends to over-predict marathon times for runners who are fast at shorter distances (like 5K) but lack the specific aerobic endurance or muscular resilience for the marathon. Conversely, it can under-predict sprint times (100m-400m) for distance runners, as pure speed relies heavily on neuromuscular factors and fast-twitch muscle fibers that aren't accurately reflected in a 5K or 10K time. It assumes an 'ideal' runner who is equally trained across all energy systems.","The calculator is highly aware of different energy systems, as evidenced by its specific training pace outputs. It categorizes paces into distinct physiological zones: Recovery, Easy, Moderate, Tempo, MLSS/Threshold (glycolytic/aerobic boundary), CV (Critical Velocity - targeting Type IIa muscle fibers), Aerobic Power, VO2 max (maximum aerobic capacity), Mixed Zone, Anaerobic Capacity, Anaerobic Power, Speed Endurance, and Speed (ATP-CP/glycolytic). This demonstrates a nuanced approach to targeting specific energy systems through varied training intensities.","The most unique feature of the Tinman calculator is its emphasis on and specific calculation of 'Critical Velocity' (CV) pace. Tom Schwartz popularized CV training (typically 10K pace or the pace sustainable for ~30-45 minutes) as the optimal intensity for improving Type IIa (fast-twitch oxidative) muscle fibers without causing excessive fatigue. The calculator specifically outputs this CV pace, along with a very granular breakdown of other training intensities (like MLSS, Aerobic Power, and Mixed Zone) that are not typically found in standard calculators like McMillan or Jack Daniels.",8,"A knowledgeable track/XC coach would generally trust this tool's output for middle and long-distance runners, particularly for setting training paces. Tom Schwartz is a highly respected coach who has trained elite athletes, and his Critical Velocity (CV) concept is widely adopted in the running community. The calculator provides very specific, actionable training paces (like CV, Tempo, Aerobic Power) that align well with modern endurance training philosophy. However, a coach might be skeptical of its sprint predictions (100m-400m) when derived from long-distance inputs, as endurance and sprint capabilities rely on different physiological traits. Overall, for its primary purpose—prescribing endurance training paces—it is highly credible.",
IAAF/World Athletics scoring tables and age-grading calculators (Alan Jones WMA tables),IAAF/World Athletics Scoring Tables and WMA Age-Grading Calculators,https://worldathleticsscores.com/ (WA Points) and https://runbundle.com/tools/age-grading-calculator (Age-Grading),"The IAAF scoring tables use specific mathematical formulas to calculate points for different events. For track events (running), the formula is P = a * (b - T) ^ c, where P is the points score, T is the performance time in seconds, and a, b, and c are event-specific parameters (constants). For jumping events, the formula is P = a * (M - b) ^ c, where M is the measurement in centimeters. For throwing events, the formula is P = a * (D - b) ^ c, where D is the distance in meters. The parameters a, b, and c are derived through statistical analysis (polynomial regression) of world-class performances and are periodically updated by World Athletics. \n\nFor WMA age-grading, the core formula involves calculating an age-grading percentage. The formula is: Age-grading percentage = (Age-standard time / Athlete time) * 100. The Age-standard time is derived from the Open-class-standard (the world record or best possible time for a senior athlete) divided by an Age-factor. The Age-factor is a value equal to 1 or less, determined by statistical analysis of performances across different age groups. For time-based events, the age-graded result is calculated as Athlete time * Age-factor.","All standard track and field events (e.g., 100m to 10,000m) and road running events (e.g., 5km to Marathon, and up to 500 miles for some age-grading calculators).","Event/Distance, Gender, Performance (Time/Distance/Height), Age (for age-grading)","IAAF Points Score, Age-Graded Time, Age-Grading Percentage, Open-Class Standard, Age-Standard","The calculators handle sprint events (100m, 200m, 400m) by using specific parameters (a, b, c) for each event in the IAAF scoring formula, or specific age-factors in the WMA age-grading tables. They evaluate sprint performances independently based on statistical data for those specific events. They do not attempt to predict sprint times from distance times or vice versa; they only provide a point score or age-grading percentage to allow for comparison of the relative quality of the performances.","A documented criticism of the IAAF scoring tables is that they are based on statistical distributions of elite performances rather than physiological models. This can lead to disproportionate scores across different events, especially as world records evolve. For example, some researchers argue that the tables undervalue certain sprint performances compared to endurance events, or vice versa, depending on the era and the specific parameters used. \n\nFor WMA age-grading, a known weakness is that the factors are influenced by the depth of competition in different age groups. Older age groups have fewer competitors, which can result in \""softer\"" records and age-factors that may over-reward performances compared to younger, more competitive age groups. Additionally, the tables do not account for individual physiological differences or the fact that endurance athletes may peak later than sprinters. The system also struggles with outlier performances, such as those by exceptional masters athletes, which can skew the statistical curve. It does not explicitly attempt sprint-to-distance transfer predictions.",None - treats all distances as single continuum based on statistical performance data rather than physiological energy systems.,"The unique feature of these tools is their official status and comprehensive statistical foundation. The IAAF scoring tables are the official method used by World Athletics for world rankings and combined events (like the decathlon). The WMA age-grading tables are the official standard for masters athletics, allowing for direct comparison of performances across different ages, genders, and events using a single percentage metric. They are based on the most extensive database of global athletics performances available.",9,"A knowledgeable track/XC coach would highly trust this tool's output because it is the official scoring system used by World Athletics (formerly IAAF) and World Masters Athletics (WMA). The tables are based on extensive statistical analysis of world-class performances across all events and age groups. Coaches use these tables to compare performances across different events (e.g., a 100m sprint vs. a 1500m run) and to evaluate the relative quality of performances by athletes of different ages and genders. The age-grading factors, maintained by statisticians like Alan Jones, are widely accepted as the standard for masters athletics. However, coaches also recognize the limitations, such as the fact that the tables are based on elite performances and may not perfectly apply to recreational runners, and that age-grading can sometimes over-reward older athletes in certain events due to a smaller competitive pool. Overall, it is the most authoritative and widely used system in the sport.",
Mercier Score and Canova prediction methods for elite runners,Mercier Score and Canova Prediction Methods,https://jmureika.lmu.build/track/Mercier/instructions.html (Mercier Score) / https://coachsaltmarsh.com/canova-race-pace-calculator/ (Canova Pace Calculator),"The Mercier Score uses a linear fit to the weighted average of the 5th, 10th, 20th, 50th, and 100th World-ranked performances. For track events, the weighted average speed (Vwt = D / Twt) is calculated, and points are assigned based on the equation: Points = A x Vwt + B. For field events, the square root of the performance is used instead of speed. The Canova Prediction Formula for marathon performance is: MP (Marathon Performance, in minutes) = C * (S)^E, where C is the Canova Constant (4800), S is the average speed of all training runs (km/h) distributed across a modulation of speeds between 60% and 110% of Marathon pace, and E is the Power Exponent (-1.3), showing a power law relationship between increasing speed and lower marathon times.",100m to Marathon (Mercier Score covers all track and field events; Canova focuses primarily on Marathon and Half Marathon),"For Mercier Score: Event, Time (Hours, Minutes, Seconds) or Distance/Points. For Canova Formula: Average speed of all training runs (km/h).",Mercier Score: Point value comparing the performance to world-class standards. Canova Formula: Predicted Marathon Performance (in minutes).,"The Mercier Score handles sprint events (100m, 200m, 400m) by calculating the weighted average speed (Vwt = D / Twt) and applying a linear fit to assign points, allowing for comparison between sprints and distance events. The Canova method is primarily focused on distance running (800m to marathon) and does not typically attempt sprint prediction from distance times, though it uses supramaximal speeds (>105% of goal race pace) for speed support in distance training.","The Mercier Score's reliance on world rankings means it can be skewed if an event has a weak year, and it may not perfectly translate to non-elite runners. The Canova prediction formula's main weakness is its assumption that average training speed is the primary predictor of marathon success, which may undervalue the importance of volume for some runners and could lead to overtraining if non-elites attempt to match the intensity of elite programs. It may also over-predict marathon times for runners who train fast but lack the endurance for the full distance.","The Canova method is highly aware of energy systems, categorizing training into Regeneration (<80% GRP), Fundamental (80-90% GRP), Special (90-95% GRP for Lactate Threshold), Specific (95-105% GRP for race metabolic demand), and Supramaximal (>105% GRP for speed support). The Mercier Score is a statistical comparison tool and does not explicitly account for energy systems.","The Mercier Score uniquely compares performances across all track and field events (including field events and multi-events) using a statistical analysis of world rankings. The Canova method uniquely prescribes training paces as strict percentages of Goal Race Pace (GRP) rather than current fitness (like VDOT or HR zones), working backward from the goal to stimulate specific adaptations.",8,"A knowledgeable track/XC coach would likely trust the Mercier Score for comparing performances across different events, as it is based on a robust statistical analysis of world-ranked performances and is used by Athletics Canada. However, they might be more cautious with the Canova prediction formula for marathon times, as it relies heavily on average training speed and assumes a specific high-intensity training methodology that may not apply to all runners. The Canova method is highly respected for elite marathon training, but its predictive formula based on average training speed is a newer concept that may not be universally accepted without further validation across diverse runner profiles.",
